obviously prefers hot places when it rains steam is said to spout from the tip of its tail;FIRE
the flame at the tip of its tail makes a sound as it burns you can only hear it in quiet places;FIRE
the flame on its tail shows the strength of its life force if it is weak the flame also burns weakly;FIRE
the flame on its tail indicates charmander’s life force if it is healthy the flame burns brightly;FIRE
if it’s healthy the flame on the tip of its tail will burn vigorously even if it gets a bit wet;FIRE
the flame that burns at the tip of its tail is an indication of its emotions the flame wavers when charmander is enjoying itself if the pokémon becomes enraged the flame burns fiercely;FIRE
from the time it is born a flame burns at the tip of its tail its life would end if the flame were to go out;FIRE
it has a preference for hot things when it rains steam is said to spout from the tip of its tail;FIRE
the flame that burns at the tip of its tail is an indication of its emotions the flame wavers when charmander is happy and blazes when it is enraged;FIRE
the fire on the tip of its tail is a measure of its life if healthy its tail burns intensely;FIRE
the fire on the tip of its tail is a measure of its life if the pokémon is healthy its tail burns intensely;FIRE
when it swings its burning tail it elevates the temperature to unbearably high levels;FIRE
tough fights could excite this pokémon when excited it may blow out bluish-white flames;FIRE
it is very hotheaded by nature so it constantly seeks opponents it calms down only when it wins;FIRE
it has a barbaric nature in battle it whips its fiery tail around and slashes away with sharp claws;FIRE
if it becomes agitated during battle it spouts intense flames incinerating its surroundings;FIRE
charmeleon mercilessly destroys its foes using its sharp claws if it encounters a strong foe it turns aggressive in this excited state the flame at the tip of its tail flares with a bluish white color;FIRE
it lashes about with its tail to knock down its foe it then tears up the fallen opponent with sharp claws;FIRE
when it swings its burning tail it elevates the air temperature to unbearably high levels;FIRE
without pity its sharp claws destroy foes if it encounters a strong enemy it becomes agitated and the flame on its tail flares with a bluish white color;FIRE
in the rocky mountains where charmeleon live their fiery tails shine at night like stars;FIRE
tough fights could excite this pokémon when excited it may breathe out bluish-white flames;FIRE
at the time of birth it has just one tail the tail splits from its tip as it grows older;FIRE
both its fur and its tails are beautiful as it grows the tails split and form more tails;FIRE
as it develops its single white tail gains color and splits into six it is quite warm and cuddly;FIRE
if it is attacked by an enemy that is stronger than itself it feigns injury to fool the enemy and escapes;FIRE
as its body grows larger its six warm tails become more beautiful with a more luxurious coat of fur;FIRE
at the time of its birth vulpix has one white tail the tail separates into six if this pokémon receives plenty of love from its trainer the six tails become magnificently curled;FIRE
inside vulpix’s body burns a flame that never goes out during the daytime when the temperatures rise this pokémon releases flames from its mouth to prevent its body from growing too hot;FIRE
while young it has six gorgeous tails when it grows several new tails are sprouted;FIRE
when it is born it has just one snow-white tail the tail splits from its tip as it grows older;FIRE
it can freely control fire making fiery orbs fly like will-o’-the-wisps just before evolution its six tails grow hot as if on fire;FIRE
it controls balls of fire as it grows its six tails split from their tips to make more tails;FIRE
as each tail grows its fur becomes more lustrous when held it feels slightly warm;FIRE
its beautiful fur and tails have made it very popular as it grows its tails split to form more tails;FIRE
from its mouth spew flames that seem to resemble the spirits of the deceased some people mistakenly think this fire is a ghost;FIRE
its beautiful tails have made it very popular however if it’s not brushed diligently it will be a mass of tangles before you know it;FIRE
it manipulates balls of fire to catch its prey if you raise one from when it’s young it will grow close to you like a puppy pokémon;FIRE
in its belly burns a fire which vulpix spits out in the form of fireballs when young this pokémon has but one white tail as the pokémon matures this single tail splits into six;FIRE
very smart and very vengeful grabbing one of its many tails could result in a 1000-year curse;FIRE
according to an enduring legend 9 noble saints were united and reincarnated as this pokémon;FIRE
some legends claim that each of its nine tails has its own unique type of special mystical power;FIRE
its nine beautiful tails are filled with a wondrous energy that could keep it alive for 1000 years;FIRE
it is said to live a thousand years and each of its tails is loaded with supernatural powers;FIRE
ninetales casts a sinister light from its bright red eyes to gain total control over its foe’s mind this pokémon is said to live for a thousand years;FIRE
legend has it that ninetales came into being when nine wizards possessing sacred powers merged into one this pokémon is highly intelligent it can understand human speech;FIRE
it has nine long tails and fur that gleams gold it is said to live for 1000 years;FIRE
very smart and very vengeful grabbing one of its many tails could result in a 1000-year curse;FIRE
it has long been said that each of the nine tails embody an enchanted power a long-lived ninetales will have fur that shines like gold;FIRE
its nine tails are said to be imbued with a mystic power it can live for a thousand years;FIRE
each of its nine tails is imbued with supernatural power and it can live for a thousand years;FIRE
legend has it that ninetales came into being when nine wizards possessing sacred powers merged into one this pokémon is highly intelligent—it can understand human speech;FIRE
legend has it that this mystical pokémon was formed when nine saints coalesced into one;FIRE
said to live for a thousand years this pokémon uses its supernatural abilities to manipulate fire it can burn its prey to a crisp as it pleases;FIRE
it is vindictive and relentless by nature those who cross it even once will be cursed for a thousand years along with their descendants;FIRE
the flickering flames it spews from its mouth leave its opponents hypnotized then this extremely intelligent pokémon attacks;FIRE
according to an enduring legend nine noble saints were united and reincarnated as this pokémon;FIRE
it is said to live 1000 years and each of its tails is loaded with supernatural powers;FIRE
its nine tails are said to be imbued with a mystic power the pokémon is said to live for 1000 years;FIRE
the coat of gleaming golden fur is quite magnificent this species is said to store sacred power in its nine long tails and to live for a millennium;FIRE
very protective of its territory it will bark and bite to repel intruders from its space;FIRE
a pokémon with a friendly nature however it will bark fiercely at anything invading its territory;FIRE
it has a brave and trustworthy nature it fearlessly stands up to bigger and stronger foes;FIRE
extremely loyal it will fearlessly bark at any opponent to protect its own trainer from harm;FIRE
it controls a big territory if it detects an unknown smell it roars loudly to force out the intruder;FIRE
growlithe has a superb sense of smell once it smells anything this pokémon won’t forget the scent no matter what it uses its advanced olfactory sense to determine the emotions of other living things;FIRE
very friendly and faithful to people it will try to repel enemies by barking and biting;FIRE
it is very protective of its territory it will bark and bite to repel intruders from its space;FIRE
its superb sense of smell ensures that this pokémon won’t forget any scent no matter what it uses its sense of smell to detect the emotions of others;FIRE
a pokémon with a loyal nature it will remain motionless until it is given an order by its trainer;FIRE
extremely loyal to its trainer it will bark at those who approach the trainer unexpectedly and run them out of town;FIRE
it’s both clever and loyal but if a stranger tries to invade its territory it barks threateningly;FIRE
it looks cute but when you approach another trainer’s growlithe it will bark at you and bite;FIRE
while it’s quite friendly toward humans once it’s grown used to them in the wild it must be quite fierce to defend its territory from rockruff;FIRE
it has lived alongside humans since ages ago its bones have been found in excavations of ruins from the stone age;FIRE
it is a pokémon with a loyal nature it will remain motionless until it is given an order by its trainer;FIRE
it’s very friendly and faithful to people it will try to repel enemies by barking and biting;FIRE
a pokémon that has been admired since the past for its beauty it runs agilely as if on wings;FIRE
a legendary pokémon in china many people are charmed by its grace and beauty while running;FIRE
this legendary chinese pokemon is considered magnificent many people are enchanted by its grand mane;FIRE
its magnificent bark conveys a sense of majesty anyone hearing it can’t help but grovel before it;FIRE
an ancient picture scroll shows that people were attracted to its movement as it ran through prairies;FIRE
arcanine is known for its high speed it is said to be capable of running over 6200 miles in a single day and night the fire that blazes wildly within this pokémon’s body is its source of power;FIRE
a pokémon that is described in chinese legends it is said to race at an unbelievable speed;FIRE
a pokémon that has long been admired for its beauty it runs agilely as if on wings;FIRE
this fleet-footed pokémon is said to run over 6200 miles in a single day and night the fire that blazes wildly within its body is its source of power;FIRE
its proud and regal appearance has captured the hearts of people since long ago;FIRE
this legendary chinese pokémon is considered magnificent many people are enchanted by its grand mane;FIRE
the sight of it running over 6200 miles in a single day and night has captivated many people;FIRE
overflowing with beauty and majesty this strong pokémon appears in ancient eastern folklore;FIRE
the fire burning inside its body serves as the energy to fuel it as it runs great distances it appears in many legends;FIRE
legends tell of its fighting alongside a general and conquering a whole country;FIRE
there are so many old tales about them that they’re called legendary pokémon but there are way more of them around than you’d expect;FIRE
a legendary pokémon in the east many people are charmed by the grace and beauty of its running;FIRE
an ancient picture scroll shows that people were captivated by its movement as it ran through prairies;FIRE
its hooves are 10 times harder than diamonds it can trample anything completely flat in little time;FIRE
capable of jumping incredibly high its hooves and sturdy legs absorb the impact of a hard landing;FIRE
it is a weak runner immediately after birth it gradually becomes faster by chasing after its parents;FIRE
its hind legs which have harder-than-diamond hooves kick back at any presence it senses behind it;FIRE
training by jumping over grass that grows longer every day has made it a world-class jumper;FIRE
ponyta is very weak at birth it can barely stand up this pokémon becomes stronger by stumbling and falling to keep up with its parent;FIRE
its body is light and its legs are incredibly powerful it can clear ayers rock in one leap;FIRE
its hooves are ten times harder than diamond it can trample anything completely flat in little time;FIRE
a ponyta is very weak at birth it can barely stand up its legs become stronger as it stumbles and falls while trying to keep up with its parent;FIRE
about an hour after birth its fiery mane and tail grow out giving it an impressive appearance;FIRE
its legs grow strong while it chases after its parent it runs in fields and mountains all day;FIRE
as a newborn it can barely stand however through galloping its legs are made tougher and faster;FIRE
its hind legs which have hooves that are harder than diamond kick back at any presence it senses behind it;FIRE
it can’t run properly when it’s newly born as it races around with others of its kind its legs grow stronger;FIRE
if you’ve been accepted by ponyta its burning mane is mysteriously no longer hot to the touch;FIRE
about an hour after birth ponyta’s fiery mane and tail grow out giving the pokémon an impressive appearance;FIRE
its legs grow strong while it chases after its parents it runs all day in fields and on mountains;FIRE
these pokémon live in herds out in the grassland newborn foals lack their fiery manes which will develop about an hour after birth;FIRE
very competitive this pokémon will chase anything that moves fast in the hopes of racing it;FIRE
just loves to run if it sees something faster than itself it will give chase at top speed;FIRE
at full gallop its four hooves barely touch the ground because it moves so incredibly fast;FIRE
with incredible acceleration it reaches its top speed of 150 mph after running just ten steps;FIRE
it just loves to gallop the faster it goes the longer the swaying flames of its mane will become;FIRE
rapidash usually can be seen casually cantering in the fields and plains however when this pokémon turns serious its fiery manes flare and blaze as it gallops its way up to 150 mph;FIRE
it can gallop at a top speed of 150 miles per hour it can race as fast as a bullet train while ablaze;FIRE
it usually canters casually in the fields and plains but once a rapidash turns serious its fiery manes flare and blaze as it gallops its way up to 150 mph;FIRE
it gallops at nearly 150 mph with its mane blazing ferociously it races as if it were an arrow;FIRE
it has astounding acceleration from a standstill it can reach top speed within 10 steps;FIRE
when at an all-out gallop its blazing mane sparkles enhancing its beautiful appearance;FIRE
with incredible acceleration it reaches its top speed of 150 mph after running just 10 steps;FIRE
this pokémon can be seen galloping through fields at speeds of up to 150 mph its fiery mane fluttering in the wind;FIRE
the fastest runner becomes the leader and it decides the herd’s pace and direction of travel;FIRE
fiery mane aglow rapidash darts like an arrow across the land this prodigiously swift creature can traverse the vast region of hisui in a day and a half;FIRE
its body always burns with an orange glow that enables it to hide perfectly among flames;FIRE
born in an active volcano its body is always cloaked in flames so it looks like a big ball of fire;FIRE
it dislikes cold places so it blows scorching flames to make the environment suitable for itself;FIRE
the fiery surface of its body gives off a wavering rippling glare that is similar to the sun;FIRE
it moves more frequently in hot areas it can heal itself by dipping its wound into lava;FIRE
in battle magmar blows out intensely hot flames from all over its body to intimidate its opponent this pokémon’s fiery bursts create heat waves that ignite grass and trees in its surroundings;FIRE
found near the mouth of a volcano this fire-breather’s body temperature is nearly 2200 degrees fahrenheit;FIRE
its body always burns with an orange glow that enables it to hide perfectly amidst flames;FIRE
in battle it blows out intense flames from all over its body to intimidate its foe these fiery bursts create heat waves that ignite grass and trees in the area;FIRE
born in the spout of a volcano its body is covered by flames that shimmer like the sun;FIRE
when it breathes deeply heat waves form around its body making it hard to see clearly;FIRE
the scorching fire exhaled by magmar forms heat waves around its body making it hard to see the pokémon clearly;FIRE
when it’s tired it leaps into the mouth of a volcano and soaks its body in magma to ease its weariness its body burns at 2192 degrees f;FIRE
when angered it spouts brilliant fire from all over its body it doesn’t calm down until its opponent has burned to ash;FIRE
its entire body is burning when it breathes the temperature rises when it sneezes flames shoot out!;FIRE
the hotter the place the better they feel magmar in alola are said to be hardier than those in other areas;FIRE
magmar dispatches its prey with fire but it regrets this habit once it realizes that it has burned its intended prey to a charred crisp;FIRE
these pokémon’s bodies are constantly burning magmar are feared as one of the causes behind fires;FIRE
it was born in the crater of a volcano its body is covered with flames that shimmer like the sun;FIRE
legend has it that this pokémon was born from the crater of a volcano when wounded it bathes in lava to heal its body much as one would soak in a hot spring;FIRE
when storing thermal energy in its body its temperature could soar to over 1600 degrees;FIRE
it has a flame chamber inside its body it inhales then blows out fire that is over 3000f degrees;FIRE
it stores some of the air it inhales in its internal flame pouch which heats it to over 3000 degrees;FIRE
it fluffs out its fur collar to cool down its body temperature which can reach 1650 degrees;FIRE
once it has stored up enough heat this pokémon’s body temperature can reach up to 1700 degrees;FIRE
flareon’s fluffy fur has a functional purpose it releases heat into the air so that its body does not get excessively hot this pokémon’s body temperature can rise to a maximum of 1650 degrees f;FIRE
it has a flame bag inside its body after inhaling deeply it blows out flames of nearly 3100 degrees fahrenheit;FIRE
when storing thermal energy in its body its temperature can soar to over 1600 degrees fahrenheit;FIRE
flareon’s fluffy fur releases heat into the air so that its body does not get excessively hot its body temperature can rise to a maximum of 1650 degrees f;FIRE
it has a flame sac in its body its body temperature tops 1650 degrees fahrenheit before battle;FIRE
inhaled air is heated in the flame sac in its body to an intense fire over 3000 degrees fahrenheit;FIRE
it stores some of the air it inhales in its internal flame pouch which heats it to over 3000 degrees fahrenheit;FIRE
it fluffs out its fur collar to cool down its body temperature which can reach 1650 degrees fahrenheit;FIRE
inhaled air is carried to its flame sac heated and exhaled as fire that reaches over 3000 degrees f;FIRE
it has a flame bag inside its body after inhaling deeply it blows out flames of nearly 3000 degrees fahrenheit;FIRE
flareon’s fluffy fur has a functional purpose—it releases heat into the air so that its body does not get excessively hot this pokémon’s body temperature can rise to a maximum of 1650 degrees fahrenheit;FIRE
when it catches prey or finds berries it breathes fire on them until they’re well done and then it gobbles them up;FIRE
its average body temperature is between 1300 and 1500 degrees fahrenheit in its internal flame sac temperatures reach 3000 degrees;FIRE
if it inhales deeply that’s a sign it’s about to attack prepare to be hit by flames of over 3000 degrees fahrenheit!;FIRE
the flame chamber inside its body ignites when flareon gets agitated reaching temperatures of up to 1650 degrees fahrenheit;FIRE
it has a flame chamber inside its body it inhales then breathes out fire that is over 3000 degrees fahrenheit;FIRE
once it has stored up enough heat this pokémon’s body temperature can reach up to 1700 degrees fahrenheit;FIRE
flames burn within a saclike organ inside this pokémon when flareon inhales these flames grow in intensity reaching a mighty 3000 degrees fahrenheit;FIRE
inhaled air is carried to its flame sac heated and exhaled as fire that reaches over 3000 degrees fahrenheit;FIRE
it is timid and always curls itself up in a ball if attacked it flares up its back for protection;FIRE
it usually stays hunched over if it is angry or surprised it shoots flames out of its back;FIRE
the fire that spouts from its back burns hottest when it is angry the flaring flames intimidate foes;FIRE
cyndaquil protects itself by flaring up the flames on its back the flames are vigorous if the pokémon is angry however if it is tired the flames splutter fitfully with incomplete combustion;FIRE
it is timid and always curls itself up in a ball if attacked it flares up its back for protection;FIRE
it flares flames from its back to protect itself the fire burns vigorously if the pokémon is angry when it is tired it sputters with incomplete combustion;FIRE
it has a timid nature if it is startled the flames on its back burn more vigorously;FIRE
hails from the johto region though usually curled into a ball due to its timid disposition it harbors tremendous firepower;FIRE
be careful if it turns its back during battle it means that it will attack with the fire on its back;FIRE
this pokémon is fully covered by nonflammable fur it can withstand any kind of fire attack;FIRE
before battle it turns its back on its opponent to demonstrate how ferociously its fire blazes;FIRE
quilava keeps its foes at bay with the intensity of its flames and gusts of superheated air this pokémon applies its outstanding nimbleness to dodge attacks even while scorching the foe with flames;FIRE
it intimidates foes with intense gusts of flames and superheated air its quick nimbleness lets it dodge attacks even while scorching an enemy;FIRE
it intimidates foes with the heat of its flames the fire burns more strongly when it readies to fight;FIRE
it intimidates foes with the heat of its flames the fire burns stronger as it prepares to fight;FIRE
this creature’s fur is most mysterious—it is wholly impervious to the burning touch of flame should quilava turn its back to you take heed! such a posture indicates a forthcoming attack;FIRE
if its rage peaks it becomes so hot that anything that touches it will instantly go up in flames;FIRE
it has a secret devastating move it rubs its blazing fur together to cause huge explosions;FIRE
when heat from its body causes the air around it to shimmer this is a sign that it is ready to battle;FIRE
typhlosion obscures itself behind a shimmering heat haze that it creates using its intensely hot flames this pokémon creates blazing explosive blasts that burn everything to cinders;FIRE
it can hide behind a shimmering heat haze that it creates using its intense flames typhlosion create blazing explosive blasts that burn everything to cinders;FIRE
it attacks using blasts of fire it creates heat shimmers with intense fire to hide itself;FIRE
it never sleeps it has to keep moving because if it stopped its magma body would cool and harden;FIRE
a common sight in volcanic areas it slowly slithers around in a constant search for warm places;FIRE
these group together in areas that are hotter than normal if it cools off its skin hardens;FIRE
molten magma courses throughout slugma’s circulatory system if this pokémon is chilled the magma cools and hardens its body turns brittle and chunks fall off reducing its size;FIRE
slugma does not have any blood in its body instead intensely hot magma circulates throughout this pokémon’s body carrying essential nutrients and oxygen to its organs;FIRE
it is a species of pokémon that lives in volcanic areas if its body cools its skin hardens and immobilizes it to avoid that it sleeps near magma;FIRE
its body is made of magma if it doesn’t keep moving its body will cool and harden;FIRE
torchic sticks with its trainer following behind with unsteady steps this pokémon breathes fire of over 1800 degrees f including fireballs that leave the foe scorched black;FIRE
torchic has a place inside its body where it keeps its flame give it a hug it will be glowing with warmth this pokémon is covered all over by a fluffy coat of down;FIRE
it has a flame sac inside its belly that perpetually burns it feels warm if it is hugged;FIRE
if attacked it strikes back by spitting balls of fire it forms in its stomach a torchic dislikes darkness because it can’t see its surroundings;FIRE
a fire burns inside so it feels very warm to hug it launches fireballs of 1800 degrees f;FIRE
inside its body is a place where it keeps a small flame hug it it will be as warm as a hot-water bottle;FIRE
a fire burns inside so it feels very warm to hug it launches fireballs of 1800 degrees fahrenheit;FIRE
torchic sticks with its trainer following behind with unsteady steps this pokémon breathes fire of over 1800 degrees fahrenheit including fireballs that leave the foe scorched black;FIRE
torchic has a place inside its body where it keeps its flame give it a hug—it will be glowing with warmth this pokémon is covered all over by a fluffy coat of down;FIRE
a fire burns inside it so it feels very warm to hug it launches fireballs of 1800 degrees fahrenheit;FIRE
torkoal digs through mountains in search of coal if it finds some it fills hollow spaces on its shell with the coal and burns it if it is attacked this pokémon spouts thick black smoke to beat a retreat;FIRE
torkoal generates energy by burning coal it grows weaker as the fire dies down when it is preparing for battle this pokémon burns more coal;FIRE
it burns coal inside its shell if it is attacked it belches thick black smoke and flees;FIRE
it battles using energy it gets from burning coal when loosing smoke from its nostrils it lets off a sound that is similar to a locomotive’s horn;FIRE
