it burns coal inside its shell for energy it blows out black soot if it is endangered;FIRE
you find abandoned coal mines full of them they dig tirelessly in search of coal;FIRE
coal is the source of torkoal’s energy large amounts of coal can be found in the mountains where they live;FIRE
if the fire burning within its shell goes out it will die those who wish to raise one in their home must always keep something flammable at hand;FIRE
you can tell how it’s feeling by the smoke spouting from its shell tremendous velocity is a sign of good health;FIRE
it burns coal to produce energy when it has burned through all of its coal it becomes unable to move;FIRE
it burns coal inside its shell for energy it blows out black soot if it is in a tough situation;FIRE
it agilely scales sheer cliffs to live atop craggy mountains its fire is put out when it sleeps;FIRE
its fiery rear end is fueled by gas made in its belly even rain can’t extinguish the fire;FIRE
it is very agile before going to sleep it extinguishes the flame on its tail to prevent fires;FIRE
the gas made in its belly burns from its rear end the fire burns weakly when it feels sick;FIRE
full of vigor and always in high spirits it was once known by the name “lantern-tail” and feared as some kind of apparition;FIRE
after birth its back swells and hardens into a shell powerfully sprays foam from its mouth;WATER
shoots water at prey while in the water withdraws into its shell when in danger;WATER
the shell is soft when it is born it soon becomes so resilient prodding fingers will bounce off it;WATER
the shell which hardens soon after it is born is resilient if you poke it it will bounce back out;WATER
when it feels threatened it draws its legs inside its shell and sprays water from its mouth;WATER
squirtle’s shell is not merely used for protection the shell’s rounded shape and the grooves on its surface help minimize resistance in water enabling this pokémon to swim at high speeds;WATER
when it retracts its long neck into its shell it squirts out water with vigorous force;WATER
after birth its back swells and hardens into a shell it powerfully sprays foam from its mouth;WATER
its shell is not just for protection its rounded shape and the grooves on its surface minimize resistance in water enabling squirtle to swim at high speeds;WATER
it shelters itself in its shell then strikes back with spouts of water at every opportunity;WATER
when it feels threatened it draws its limbs inside its shell and sprays water from its mouth;WATER
it hides in its shell to protect itself then strikes back with spouts of water at every opportunity;WATER
often hides in water to stalk unwary prey for swimming fast it moves its ears to maintain balance;WATER
when tapped this pokémon will pull in its head but its tail will still stick out a little bit;WATER
it is recognized as a symbol of longevity if its shell has algae on it that wartortle is very old;WATER
it cleverly controls its furry ears and tail to maintain its balance while swimming;WATER
its long furry tail is a symbol of longevity making it quite popular among older people;WATER
its tail is large and covered with a rich thick fur the tail becomes increasingly deeper in color as wartortle ages the scratches on its shell are evidence of this pokémon’s toughness as a battler;WATER
this pokémon is very popular as a pet its fur-covered tail is a symbol of its longevity;WATER
it often hides in water to stalk unwary prey for fast swimming it moves its ears to maintain balance;WATER
its large tail is covered with rich thick fur that deepens in color with age the scratches on its shell are evidence of this pokémon’s toughness in battle;WATER
it is said to live 10000 years its furry tail is popular as a symbol of longevity;WATER
it is a well-established symbol of longevity if its shell has algae on it that wartortle is very old;WATER
when tapped on its head this pokémon will pull it in but its tail will stick out a little bit;WATER
a brutal pokémon with pressurized water jets on its shell they are used for high speed tackles;WATER
once it takes aim at its enemy it blasts out water with even more force than a fire hose;WATER
it deliberately makes itself heavy so it can withstand the recoil of the water jets it fires;WATER
the rocket cannons on its shell fire jets of water capable of punching holes through thick steel;WATER
it firmly plants its feet on the ground before shooting water from the jets on its back;WATER
blastoise has water spouts that protrude from its shell the water spouts are very accurate they can shoot bullets of water with enough accuracy to strike empty cans from a distance of over 160 feet;WATER
it crushes its foe under its heavy body to cause fainting in a pinch it will withdraw inside its shell;WATER
the pressurized water jets on this brutal pokémon’s shell are used for high-speed tackles;WATER
the waterspouts that protrude from its shell are highly accurate their bullets of water can precisely nail tin cans from a distance of over 160 feet;WATER
the jets of water it spouts from the rocket cannons on its shell can punch through thick steel;WATER
often seen swimming elegantly by lake shores it is often mistaken for the japanese monster kappa;WATER
its slim and long limbs end in broad flippers they are used for swimming gracefully in lakes;WATER
when it swims at full speed using its long webbed limbs its forehead somehow begins to glow;WATER
it appears by waterways at dusk it may use telekinetic powers if its forehead glows mysteriously;WATER
it swims gracefully along on the quiet slow-moving rivers and lakes of which it is so fond;WATER
the webbed flippers on its forelegs and hind legs and the streamlined body of golduck give it frightening speed this pokémon is definitely much faster than even the most athletic swimmer;WATER
golduck is the fastest swimmer among all pokémon it swims effortlessly even in a rough stormy sea it sometimes rescues people from wrecked ships floundering in high seas;WATER
the forelegs are webbed helping to make it an adept swimmer it can be seen swimming elegantly in lakes etc;WATER
often seen swimming elegantly by lakeshores it is often mistaken for the japanese monster kappa;WATER
a golduck is an adept swimmer it sometimes joins competitive swimmers in training it uses psychic powers when its forehead shimmers with light;WATER
a pokémon that lives in lakes it swims faster than any human swimming champion;WATER
the flippers of its well-developed limbs give it shocking speed it is the best swimmer among pokémon;WATER
it is seen swimming dynamically and elegantly using its well-developed limbs and flippers;WATER
when its forehead shines mysteriously golduck can use the full extent of its power;WATER
it is said that the red part of its forehead grants supernatural powers to those who possess one so it was over-hunted in the past;WATER
it swims along the banks of lakes and catches fish pokémon it takes them to the shore and quietly eats them up;WATER
even fast-swimming fish pokémon can be disabled by golduck it brings them to a standstill and seizes them;WATER
a professional swimmer it can continue swimming for two days straight by waving its long tail skillfully;WATER
its long slim limbs end in broad flippers they are used for swimming gracefully in lakes;WATER
this pokémon lives in gently flowing rivers it paddles through the water with its long limbs putting its graceful swimming skills on display;WATER
old tales tell of golduck punishing those that defiled its river the guilty were dragged into the water and taken away;WATER
this pokémon lives in lakes it swims faster than any world-class swimmer;WATER
its body is strong and it has webbing on its hands and feet golduck can swim easily through rough seas clawing its way through the high waves;WATER
its newly grown legs prevent it from running it appears to prefer swimming than trying to stand;WATER
the direction of the spiral on the belly differs by area it is more adept at swimming than walking;WATER
because it is inept at walking on its newly grown legs it always swims around in water;WATER
the direction of its belly spiral differs by area the equator is thought to have an effect on this;WATER
the swirl on its belly is its insides showing through the skin it looks clearer after it eats;WATER
poliwag has a very thin skin it is possible to see the pokémon’s spiral innards right through the skin despite its thinness however the skin is also very flexible even sharp fangs bounce right off it;WATER
its slick black skin is thin and damp a part of its internal organs can be seen through the skin as a spiral pattern;WATER
its newly grown legs prevent it from walking well it appears to prefer swimming over walking;WATER
it is possible to see this pokémon’s spiral innards right through its thin skin however the skin is also very flexible even sharp fangs bounce right off it;WATER
its skin is so thin its internal organs are visible it has trouble walking on its newly grown feet;WATER
the swirl on its belly is its internal organs showing through if the swirl is tinged white that means it’s affected by some disease;WATER
it’s still not very good at walking its trainers should train this pokémon to walk every day;WATER
despite the danger it wants to come up on land so it does its best to waddle along but when an enemy finds it it rushes back to the water;WATER
the direction of the swirl on their stomachs differs depending on where they live poliwag aficionados can tell them apart at a glance;WATER
for poliwag swimming is easier than walking the swirl pattern on its belly is actually part of the pokémon’s innards showing through the skin;WATER
in rivers with fast-flowing water this pokémon will cling to a rock by using its thick lips which act like a suction cup;WATER
capable of living in or out of water when out of water it sweats to keep its body slimy;WATER
under attack it uses its belly spiral to put the foe to sleep it then makes its escape;WATER
the swirl on its belly subtly undulates staring at it may gradually cause drowsiness;WATER
the skin on most of its body is moist however the skin on its belly spiral feels smooth;WATER
though it is skilled at walking it prefers to live underwater where there is less danger;WATER
the surface of poliwhirl’s body is always wet and slick with an oily fluid because of this greasy covering it can easily slip and slide out of the clutches of any enemy in battle;WATER
its two legs are well developed even though it can live on the ground it prefers living in water;WATER
it can live in or out of water when out of water it constantly sweats to keep its body slimy;WATER
its body surface is always wet and slick with an oily fluid because of this greasy covering it can easily slip and slide out of the clutches of any enemy in battle;WATER
the spiral pattern on its belly subtly undulates staring at it gradually causes drowsiness;WATER
the surface of poliwhirl’s body is always wet and slick with a slimy fluid because of this slippery covering it can easily slip and slide out of the clutches of any enemy in battle;WATER
although it can live on land it prefers to stay in the water where it has fewer natural enemies;WATER
it marches over the land in search of bug pokémon to eat then it takes them underwater so it can dine on them where it’s safe;WATER
although it has become capable of living on land it spends its time in the water where its prey fish pokémon are plentiful;WATER
its health suffers when its skin dries out so be sure to moisturize it diligently;WATER
staring at the swirl on its belly causes drowsiness this trait of poliwhirl’s has been used in place of lullabies to get children to go to sleep;WATER
this pokémon’s sweat is a slimy mucus when captured poliwhirl can slither from its enemies’ grasp and escape;WATER
the protruding horn on its head is very hard it is used for bashing through thick ice;WATER
loves freezing cold conditions relishes swimming in a frigid climate of around 14f degrees;WATER
although it can’t walk well on land it is a graceful swimmer it especially loves being in frigid seas;WATER
in daytime it is often found asleep on the seabed in shallow waters its nostrils close while it swims;WATER
the light blue fur that covers it keeps it protected against the cold it loves iceberg-filled oceans;WATER
seel hunts for prey in the frigid sea underneath sheets of ice when it needs to breathe it punches a hole through the ice with the sharply protruding section of its head;WATER
covered with light blue fur its hide is thick and tough it is active in bitter cold of minus 40 degrees fahrenheit;WATER
the protruding horn on its head is very hard it is used for bashing through thick icebergs;WATER
seel hunt for prey in frigid ice-covered seas when it needs to breathe it punches a hole through the ice with the sharply protruding section of its head;WATER
a pokémon that lives on icebergs it swims in the sea using the point on its head to break up ice;WATER
the colder it gets the better it feels it joyfully swims around oceans so cold that they are filled with floating ice;WATER
covered with light blue fur its hide is thick and tough it is active in bitter cold of -40 degrees fahrenheit;WATER
it has always been supposed that seel live only in cold seas their having shown up in alola is a mystery;WATER
thanks to its thick fat cold seas don’t bother it at all but it gets tired pretty easily in warm waters;WATER
loves freezing-cold conditions relishes swimming in a frigid climate of around 14 degrees fahrenheit;WATER
this pokémon lives on icebergs it uses the sharp point on its head to break up ice as it swims in the sea;WATER
in the distant past it was somewhat stronger than the horribly weak descendants that exist today;WATER
famous for being very unreliable it can be found swimming in seas lakes rivers and shallow puddles;WATER
an underpowered pathetic pokémon it may jump high on rare occasions but never more than seven feet;WATER
for no reason it jumps and splashes about making it easy for predators like pidgeotto to catch it mid-jump;WATER
this weak and pathetic pokémon gets easily pushed along rivers when there are strong currents;WATER
magikarp is a pathetic excuse for a pokémon that is only capable of flopping and splashing this behavior prompted scientists to undertake research into it;WATER
magikarp is virtually useless in battle as it can only splash around as a result it is considered to be weak however it is actually a very hardy pokémon that can survive in any body of water no matter how polluted it is;WATER
it is virtually worthless in terms of both power and speed it is the most weak and pathetic pokémon in the world;WATER
its swimming muscles are weak so it is easily washed away by currents in places where water pools you can see many magikarp deposited there by the flow;WATER
it is said to be the world’s weakest pokémon no one knows why it has managed to survive;WATER
it is unable to swim against even slow-moving currents it always splashes about for some reason;WATER
a magikarp living for many years can leap a mountain using splash the move remains useless though;WATER
an underpowered pathetic pokémon it may jump high on rare occasions but usually not more than seven feet;WATER
although weak and helpless this pokémon is incredibly fertile they exist in such multitudes you’ll soon grow tired of seeing them;WATER
its reckless leaps make it easy pickings for predators on the bright side many pokémon enjoy longer life spans thanks to magikarp;WATER
in the distant past they were fairly strong but they have become gradually weaker over time;WATER
thanks to their strong hold on life dirty water doesn’t bother them at all they live in waters all over the world!;WATER
a feeble pitiful imbecile of a pokémon that is nonetheless very hardy unperturbed by turbid water it can be found living in all sorts of places;WATER
its tail fin billows like an elegant ballroom dress giving it the nickname of the water queen;WATER
when it is time for them to lay eggs they can be seen swimming up rivers and falls in large groups;WATER
its dorsal pectoral and tail fins wave elegantly in water that is why it is known as the water dancer;WATER
a strong swimmer it is capable of swimming nonstop up fast streams at a steady speed of five knots;WATER
during spawning season they swim gracefully in the water searching for their perfect mate;WATER
goldeen is a very beautiful pokémon with fins that billow elegantly in water however don’t let your guard down around this pokémon it could ram you powerfully with its horn;WATER
goldeen loves swimming wild and free in rivers and ponds if one of these pokémon is placed in an aquarium it will shatter even the thickest glass with one ram of its horn and make its escape;WATER
its dorsal and pectoral fins are strongly developed like muscles it can swim at a speed of five knots;WATER
its tail fin billows like an elegant ballroom dress giving it the nickname of “the water queen”;WATER
in the springtime schools of goldeen can be seen swimming up falls and rivers it metes out staggering damage with its single horn;WATER
it swims elegantly by flittering its tail fin as if it were a dress it has the look of a queen;WATER
it swims at a steady 5 knots if it senses danger it will strike back with its sharp horn;WATER
though it appears very elegant when swimming with fins unfurled it can jab powerfully with its horn;WATER
a strong swimmer it is capable of swimming nonstop up fast streams at a steady speed of five knots per hour;WATER
goldeen is a very beautiful pokémon with fins that billow elegantly in water however don’t let your guard down around this pokémon—it could ram you powerfully with its horn;WATER
when the weather grows warm they form groups and swim upriver this sight serves as a poetic reminder that spring has arrived;WATER
spellbound by the length of its horn and the beauty of its fins many strange trainers raise goldeen and nothing but goldeen;WATER
although known for their splendid tail fins goldeen apparently compete among themselves to see whose horn is thickest and sharpest;WATER
the way it swims along fluttering its dress-like fins has earned it the name “princess of the water”;WATER
it swims at a steady five knots if it senses danger it will strike back with its sharp horn;WATER
its hard shell repels any kind of attack it is vulnerable only when its shell is open;WATER
the shell can withstand any attack however when it is open the tender body is exposed;WATER
it swims facing backward by opening and closing its two-piece shell it is surprisingly fast;WATER
grains of sand trapped in its shells mix with its body fluids to form beautiful pearls;WATER
clamping on to an opponent reveals its vulnerable parts so it uses this move only as a last resort;WATER
at night this pokémon uses its broad tongue to burrow a hole in the seafloor sand and then sleep in it while it is sleeping shellder closes its shell but leaves its tongue hanging out;WATER
it is encased in a shell that is harder than diamond inside however it is surprisingly tender;WATER
at night it burrows a hole in the seafloor with its broad tongue to make a place to sleep while asleep it closes its shell but leaves its tongue hanging out;WATER
it swims backward by opening and closing its two shells its large tongue is always kept hanging out;WATER
the hardness of its shell surpasses the hardness of a diamond in days gone by people used the shells to make shields;WATER
this pokémon’s tongue is always hanging out it uses its tongue with great dexterity to dig up sand from the seabed in its search for food;WATER
the sand that accumulates inside its shell eventually becomes a pearl but the pearl gets in the way so it spits it out and discards it;WATER
even when its shell is closed its tongue still hangs out if you give its tongue a good yank the shock will cause shellder to open its shell;WATER
known to shoot down flying bugs with precision blasts of ink from the surface of the water;WATER
if it senses any danger it will vigorously spray water or a special type of ink from its mouth;WATER
if attacked by a larger enemy it quickly swims to safety by adeptly controlling its dorsal fin;WATER
its big developed fins move rapidly allowing it to swim backward while still facing forward;WATER
when they’re in a safe location they can be seen playfully tangling their tails together;WATER
horsea eats small insects and moss off of rocks if the ocean current turns fast this pokémon anchors itself by wrapping its tail around rocks or coral to prevent being washed away;WATER
if horsea senses danger it will reflexively spray a dense black ink from its mouth and try to escape this pokémon swims by cleverly flapping the fins on its back;WATER
it maintains balance using its tail which is wound up like a coil it may spray ink from its mouth;WATER
by cleverly flicking the fins on its back side to side it moves in any direction while facing forward it spits ink to escape if it senses danger;WATER
it makes its nest in the shade of corals if it senses danger it spits murky ink and flees;WATER
if attacked by a larger enemy it quickly swims to safety by adeptly controlling its well-developed dorsal fin;WATER
if horsea senses danger it will reflexively spray a dense black ink from its mouth and try to escape this pokémon swims by cleverly flapping the fin on its back;WATER
horsea makes its home in oceans with gentle currents if this pokémon is under attack it spits out pitch-black ink and escapes;WATER
they swim with dance-like motions and cause whirlpools to form horsea compete to see which of them can generate the biggest whirlpool;WATER
it makes its nest in the shade of corals if it senses danger it spits black ink and flees;WATER
lives close to water its long tail is ridged with a fin which is often mistaken for a mermaid’s;WATER
its cell structure is similar to water molecules it will melt away and become invisible in water;WATER
when vaporeon’s fins begin to vibrate it is a sign that rain will come within a few hours;WATER
it prefers beautiful shores with cells similar to water molecules it could melt in water;WATER
as it uses the fins on the tip of its tail to swim it blends with the water perfectly;WATER
vaporeon underwent a spontaneous mutation and grew fins and gills that allow it to live underwater this pokémon has the ability to freely control water;WATER
its body’s cellular structure is similar to the molecular composition of water it can melt invisibly in water;WATER
vaporeon underwent a spontaneous mutation and grew fins and gills that allow them to live underwater they have the ability to freely control water;WATER
it has evolved to be suitable for an aquatic life it can invisibly melt away into water;WATER
its cell composition is similar to water molecules as a result it can melt away into water;WATER
its cell composition is similar to water molecules as a result it can’t be seen when it melts away into water;WATER
its cells are composed of units much like water molecules it lives close to water and is often mistaken for a mermaid;WATER
blending in with the water and erasing all signs of its presence it patiently waits for its prey fish pokémon;WATER
clean clear waters are its usual habitat when it’s about to be attacked by an invading enemy it dives into the water to hide;WATER
it detects nearby moisture with its fin when its fin begins trembling rapidly that means rain will fall in a few hours;WATER
its cell structure is similar to water molecules it melts into the water and becomes invisible;WATER
it has evolved to be suited for an aquatic life it can become invisible when it melts away into water;WATER
tests show that its cells closely resemble water molecules which perhaps explains its ability to conceal its form while submerged i believe the origins of mermaid folklore lie with this pokémon;WATER
it lives close to water its long tail is ridged with a fin which is often mistaken for a mermaid’s;WATER
it has superb accuracy the water it shoots out can strike even moving prey from more than 300 feet;WATER
using its dorsal fin as a suction pad it clings to a mantine’s underside to scavenge for leftovers;WATER
to escape from an attacker it may shoot water out of its mouth then use that force to swim backward;WATER
remoraid sucks in water then expels it at high velocity using its abdominal muscles to shoot down flying prey when evolution draws near this pokémon travels downstream from rivers;WATER
it has superb accuracy the water it shoots out can strike even moving prey from more than 100 yards;WATER
a remoraid uses its abdominal muscles to forcefully expel swallowed water then shoot down flying prey when evolution approaches it travels down rivers;WATER
it squirts water forcefully from its mouth to shoot down flying prey;WATER
it clings to mantine to feed on the big pokémon’s scraps this is an adaptation to avoid foes;WATER
it forcefully squirts water the water jet never misses prey even if the remoraid is deep in the sea;WATER
it has superb accuracy the water it shoots out can strike moving prey from more than 300 feet away;WATER
the water they shoot from their mouths can hit moving prey from more than 300 feet away;WATER
this pokémon clings to mantine and shares in its prosperity when its mantine is attacked remoraid will fight alongside it!;WATER
also known as the “sniper of the seas” its water gun can hit prey without fail from over 300 feet away;WATER
