in terms of electrical-energy output electivire is one of the best among all electric pokémon it discharges high-voltage currents from its tails;ELECTRIC
it pushes the tips of its two tails against the foe then lets loose with over 20000 volts of electricity;ELECTRIC
its evolution was induced by an unusual item and its electrical output rises along with its heart rate from its tails it can unleash an electric current measuring 20000 volts;ELECTRIC
they have lightning-like movements when zebstrika run at full speed the sound of thunder reverberates;ELECTRIC
this ill-tempered pokémon is dangerous because when it’s angry it shoots lightning from its mane in all directions;ELECTRIC
when this ill-tempered pokémon runs wild it shoots lightning from its mane in all directions;ELECTRIC
the energy made in its cheeks’ electric pouches is stored inside its membrane and released while it is gliding;ELECTRIC
they live on treetops and glide using the inside of a cape-like membrane while discharging electricity;ELECTRIC
it glides on its outstretched membrane while shocking foes with the electricity stored in the pouches on its cheeks;ELECTRIC
it glides using its cape-like membrane electrical energy scatters from it shocking its friends and foes alike;ELECTRIC
it grills berries and bug pokémon with electric shocks and makes a meal of them it usually nests in the holes gouged in trees by pikipek;ELECTRIC
they store up electricity to fly through the air when thunder cracks at night sometimes there are almost enough of them to blot out the sky;ELECTRIC
as it flies it scatters electricity around so bird pokémon keep their distance that’s why emolga can keep all its food to itself;ELECTRIC
as emolga flutters through the air it crackles with electricity this pokémon is cute but it can cause a lot of trouble;ELECTRIC
this pokémon absolutely loves sweet berries sometimes it stuffs its cheeks full of so much food that it can’t fly properly;ELECTRIC
while one alone doesn’t have much power a chain of many tynamo can be as powerful as lightning;ELECTRIC
these pokémon move in schools they have an electricity-generating organ so they discharge electricity if in danger;ELECTRIC
one alone can emit only a trickle of electricity so a group of them gathers to unleash a powerful electric shock;ELECTRIC
they coil around foes and shock them with electricity-generating organs that seem simply to be circular patterns;ELECTRIC
these pokémon have a big appetite when they spot their prey they attack it and paralyze it with electricity;ELECTRIC
it wraps itself around its prey and paralyzes it with electricity from the round spots on its sides then it chomps;ELECTRIC
they crawl out of the ocean using their arms they will attack prey on shore and immediately drag it into the ocean;ELECTRIC
with their sucker mouths they suck in prey then they use their fangs to shock the prey with electricity;ELECTRIC
it latches on to prey with its sucker mouth sinking in its fangs and shocking the prey with powerful electricity;ELECTRIC
curls up into a spiny ball when threatened it can roll while curled up to attack or escape;GROUND
it is skilled at slashing enemies with its claws if broken they start to grow back in a day;GROUND
in an attempt to hide itself it will run around at top speed to kick up a blinding dust storm;GROUND
if it digs at an incredible pace it may snap off its spikes and claws they grow back in a day;GROUND
adept at climbing trees it rolls into a spiny ball then attacks its enemies from above;GROUND
sandslash’s body is covered by tough spikes which are hardened sections of its hide once a year the old spikes fall out to be replaced with new spikes that grow out from beneath the old ones;GROUND
sandslash can roll up its body as if it were a ball covered with large spikes in battle this pokémon will try to make the foe flinch by jabbing it with its spines it then leaps at the stunned foe to tear wildly with its sharp claws;GROUND
it is adept at attacking with the spines on its back and its sharp claws while quickly scurrying about;GROUND
it curls up in a ball to protect itself from enemy attacks it also curls up to prevent heatstroke during the daytime when temperatures rise sharply;GROUND
it curls up then rolls into foes with its back its sharp spines inflict severe damage;GROUND
the spikes on its body are made up of its hardened hide it rolls up and attacks foes with its spikes;GROUND
although they are sharp its claws and spikes often break off they grow back the next day so it is not bothered by the temporary loss;GROUND
it uses its claws to climb trees and then curls its body into a spiny ball ready to drop onto any prey that appears;GROUND
its claws and horns often break off the broken claws and horns can be used to carve plows for tilling farm fields;GROUND
thanks to its thick claws it’s good at climbing trees there are plenty of sandslash that park themselves in trees and go right to sleep;GROUND
the drier the area sandslash lives in the harder and smoother the pokémon’s spikes will feel when touched;GROUND
it climbs trees by hooking on with its sharp claws sandslash shares the berries it gathers dropping them down to sandshrew waiting below the tree;GROUND
lives about one yard underground where it feeds on plant roots it sometimes appears above ground;GROUND
it prefers dark places it spends most of its time underground though it may pop up in caves;GROUND
its skin is very thin if it is exposed to light its blood heats up causing it to grow weak;GROUND
if a diglett digs through a field it leaves the soil perfectly tilled and ideal for planting crops;GROUND
it digs underground and chews on tree roots sticking its head out only when the sun isn’t bright;GROUND
diglett are raised in most farms the reason is simple wherever this pokémon burrows the soil is left perfectly tilled for planting crops this soil is made ideal for growing delicious vegetables;GROUND
it burrows through the ground at a shallow depth it leaves raised earth in its wake making it easy to spot;GROUND
lives about one yard underground where it feeds on plant roots it sometimes appears aboveground;GROUND
diglett are raised in most farms the reason is simple--wherever they burrow the soil is left perfectly tilled for growing delicious crops;GROUND
a pokémon that lives underground because of its dark habitat it is repelled by bright sunlight;GROUND
diglett are raised in most farms the reason is simple— wherever this pokémon burrows the soil is left perfectly tilled for planting crops this soil is made ideal for growing delicious vegetables;GROUND
it chews on plant roots underground farmers whose vegetables are vulnerable find it can be quite a pest;GROUND
many farmers cherish and nurture diglett because its droppings enrich the soil it lives in;GROUND
it travels through tunnels that it digs underground it hates sunlight so it comes out only after the sun goes down;GROUND
around their crops farmers plant the kind of tree that diglett like to eat as a way of getting diglett to plow the fields for them;GROUND
this pokémon lives underground because of its dark habitat it is repelled by bright sunlight;GROUND
it lives about one yard underground where it feeds on plant roots it sometimes appears aboveground;GROUND
a team of diglett triplets it triggers huge earthquakes by burrowing 60 miles underground;GROUND
a team of triplets that can burrow over 60 mph due to this some people think it’s an earthquake;GROUND
its three heads bob separately up and down to loosen the soil nearby making it easier for it to burrow;GROUND
extremely powerful they can dig through even the hardest ground to a depth of over 60 miles;GROUND
these diglett triplets dig over 60 miles below sea level no one knows what it’s like underground;GROUND
dugtrio are actually triplets that emerged from one body as a result each triplet thinks exactly like the other two triplets they work cooperatively to burrow endlessly;GROUND
in battle it digs through the ground and strikes the unsuspecting foe from an unexpected direction;GROUND
because the triplets originally split from one body they think exactly alike they work cooperatively to burrow endlessly through the ground;GROUND
its three heads move alternately driving it through tough soil to depths of over 60 miles;GROUND
this set of triplets moves cooperatively it’s the power of teamwork that enables this pokémon to dig to a depth of 60 miles;GROUND
despite the closeness between this pokémon and farmers and other people no one has ever seen the parts of it concealed underground;GROUND
while the three of them normally get along splendidly on rare occasions a huge fight will break out over which head gets to eat first;GROUND
dugtrio’s heads are sleek and smooth and incredibly hard it can dig through any soil with its headbutts;GROUND
a team of triplets that can burrow to a depth of 60 miles it’s reported that this triggers an earthquake;GROUND
found in fields and mountains mistaking them for boulders people often step or trip on them;GROUND
commonly found near mountain trails etc if you step on one by accident it gets angry;GROUND
most people may not notice but a closer look should reveal that there are many geodude around;GROUND
it uses its arms to steadily climb steep mountain paths it swings its fists around if angered;GROUND
proud of their sturdy bodies they bash against each other in a contest to prove whose is harder;GROUND
the longer a geodude lives the more its edges are chipped and worn away making it more rounded in appearance however this pokémon’s heart will remain hard craggy and rough always;GROUND
when geodude sleeps deeply it buries itself halfway into the ground it will not awaken even if hikers step on it unwittingly in the morning this pokémon rolls downhill in search of food;GROUND
its round form makes it easy to pick up some people have used them to hurl at each other in a snowball fight;GROUND
it climbs mountain paths using only the power of its arms because they look just like boulders lining paths hikers may step on them without noticing;GROUND
many live on mountain trails and remain half buried while keeping an eye on climbers;GROUND
it is impossible to distinguish from rocks it slams against others in contests of hardness;GROUND
at rest it looks just like a rock carelessly stepping on it will make it swing its fists angrily;GROUND
its round body makes it easy to pick up but it is hard and heavy it’s dangerous to play with them as if they were snowballs;GROUND
there are plenty of them to be found along any road a scholar with too much free time once counted a hundred of them along a single route;GROUND
geodude that have lived a long life have had all their edges smoothed out until they’re totally round they also have a calm quiet disposition;GROUND
it uses both hands to climb precipitous cliffs people who see it in action have been known to take up bouldering;GROUND
commonly found near mountain trails and the like if you step on one by accident it gets angry;GROUND
many live on mountain trails and remain half-buried while keeping an eye on climbers;GROUND
it is impossible to distinguish from rocks it slams against others in contests of toughness;GROUND
makes its home in mountainous regions using its arms to climb along harsh mountain roads can be troublesome—carelessly kicking one will cause it to fly into a rage and chase after you;GROUND
as it grows the stone portions of its body harden to become similar to a diamond but colored black;GROUND
burrows at high speed in search of food the tunnels it leaves are used as homes by digletts;GROUND
it twists and squirms through the ground the thunderous roar of its tunneling echoes a long way;GROUND
it rapidly bores through the ground at 50 mph by squirming and twisting its massive rugged body;GROUND
as it digs through the ground it absorbs many hard objects this is what makes its body so solid;GROUND
onix has a magnet in its brain it acts as a compass so that this pokémon does not lose direction while it is tunneling as it grows older its body becomes increasingly rounder and smoother;GROUND
it usually lives underground it searches for food while boring its way through the ground at 50 miles per hour;GROUND
as it grows the stone portions of its body harden to become similar to black-colored diamonds;GROUND
there is a magnet in its brain that prevents an onix from losing direction while tunneling as it grows older its body becomes steadily rounder and smoother;GROUND
when it travels underground it causes rumbling and tremors it can move at 50 mph;GROUND
it squirms through the ground using its long and rugged body it always eats while burrowing;GROUND
it burrows through the ground at a speed of 50 mph while feeding on large boulders;GROUND
opening its large mouth it ingests massive amounts of soil and creates long tunnels;GROUND
burrows at high speed in search of food the tunnels it leaves are used as homes by diglett;GROUND
this chain of immense stones resembles a giant serpent tremors shake the earth above as it burrows deep beneath the ground feeding on boulders as it goes;GROUND
the bone it holds is its key weapon it throws the bone skillfully like a boomerang to ko targets;GROUND
small and weak this pokémon is adept with its bone club it has grown more vicious over the ages;GROUND
it has been seen pounding boulders with the bone it carries in order to tap out messages to others;GROUND
it collects bones from an unknown place a marowak graveyard exists somewhere in the world rumors say;GROUND
somewhere in the world is a cemetery just for marowak it gets its bones from those graves;GROUND
marowak is the evolved form of a cubone that has overcome its sadness at the loss of its mother and grown tough this pokémon’s tempered and hardened spirit is not easily broken;GROUND
it is small and was originally very weak its temperament turned ferocious when it began using bones;GROUND
a marowak is the evolved form of a cubone that has grown tough by overcoming the grief of losing its mother its tempered and hardened spirit is not easily broken;GROUND
from its birth this savage pokémon constantly holds bones it is skilled in using them as weapons;GROUND
it collects bones from an unknown place some whisper that a marowak graveyard exists somewhere in the world;GROUND
originally it was weak and timid after evolution its temperament becomes violent and it begins to wield bones as weapons;GROUND
this pokémon is out for vengeance on its natural enemy mandibuzz it throws bones like boomerangs to try to take it down;GROUND
it throws bones at mandibuzz to knock it down it’s thought that marowak is trying to avenge its parent;GROUND
they thump their bones rhythmically to communicate among themselves there are nearly 50 different rhythmic patterns;GROUND
this pokémon overcame its sorrow to evolve a sturdy new body marowak faces its opponents bravely using a bone as a weapon;GROUND
when this pokémon evolved the skull of its mother fused to it marowak’s temperament also turned vicious at the same time;GROUND
the bones it uses have been in its possession since it was born it has a ferocious nature;GROUND
it has sharp hard tusks and a rugged hide its tackle is strong enough to knock down a house;GROUND
the longer and bigger its tusks the higher its rank in its herd the tusks take long to grow;GROUND
because this pokémon’s skin is so tough a normal attack won’t even leave a scratch on it;GROUND
donphan’s favorite attack is curling its body into a ball then charging at its foe while rolling at high speed once it starts rolling this pokémon can’t stop very easily;GROUND
if donphan were to tackle with its hard body even a house could be destroyed using its massive strength the pokémon helps clear rock and mud slides that block mountain trails;GROUND
the longer and bigger its tusks the higher its rank in its herd the tusks take a long time to grow;GROUND
a donphan is so strong it can easily haul a dump truck its hide has toughened to a rock-hard state an ordinary sort of attack won’t even leave a scratch;GROUND
it attacks by curling up then rolling into its foe it can blow apart a house in one hit;GROUND
it attacks by curling up then rolling into its foe it can blow apart a house in one hit;GROUND
it attacks by curling up and rolling into its foe it can blow apart a house in one hit;GROUND
donphan is covered in tough hide so even being hit by a car won’t faze this pokémon however it is extremely susceptible to rain;GROUND
donphan is normally a calm pokémon but once it is enraged it will curl its body into a ball and charge at you while rolling;GROUND
trapinch’s nest is a sloped bowl-like pit dug in sand this pokémon patiently waits for prey to tumble down the pit its giant jaws have enough strength to crush even boulders;GROUND
trapinch is a patient hunter it digs an inescapable pit in a desert and waits for its prey to come tumbling down this pokémon can go a whole week without access to any water;GROUND
it lives in arid deserts it makes a sloping pit trap in sand where it patiently awaits prey;GROUND
its big jaws crunch through boulders because its head is so big it has a hard time getting back upright if it tips over onto its back;GROUND
it makes a conical pit in desert sand and lies in wait at the bottom for prey to come tumbling down;GROUND
its nest is a sloped bowl-like pit in the desert once something has fallen in there is no escape;GROUND
it makes an inescapable conical pit and lies in wait at the bottom for prey to come tumbling down;GROUND
it can live for a week without eating a thing it waits patiently at the bottom of its nest for prey to appear;GROUND
as it digs through the sand its giant jaws crush any rocks that obstruct its path it builds a funnel-shaped nest;GROUND
its jaws are strong enough to crush rocks but so heavy that it can’t get up if it flips over sandile seize those moments as their chance;GROUND
it builds nests that double as traps lying in wait for its prey to get caught when night falls it digs itself a spot beneath the sand to sleep;GROUND
groudon has long been described in mythology as the pokémon that raised lands and expanded continents this pokémon took to sleep after a cataclysmic battle with kyogre;GROUND
groudon has the power to scatter rain clouds and make water evaporate with light and heat it came as a savior to people who had been suffering from terrible floods;GROUND
this legendary pokémon is said to represent the land it went to sleep after dueling kyogre;GROUND
groudon has appeared in mythology as the creator of the land it sleeps in magma underground and is said to make volcanoes erupt on awakening;GROUND
it had been asleep in underground magma ever since it fiercely fought kyogre long ago;GROUND
said to have expanded the lands by evaporating water with raging heat it battled titanically with kyogre;GROUND
groudon is said to be the personification of the land itself legends tell of its many clashes against kyogre as each sought to gain the power of nature;GROUND
through primal reversion and with nature’s full power it will take back its true form it can cause magma to erupt and expand the landmass of the world;GROUND
it lives in arid places instead of perspiration it expels grainy sand from its body;GROUND
it enshrouds itself with sand to protect itself from germs it does not enjoy getting wet;GROUND
it shuts its nostrils tight then travels through sand as if walking they form colonies of around ten;GROUND
it shrouds itself in sand to ward off germs it travels easily through the sands of the desert;GROUND
it shuts its nostrils tight then travels through sand as if walking they form colonies of around 10;GROUND
it moves through the sands with its mouth open swallowing sand along with its prey it gets rid of the sand by spouting it from its nose;GROUND
this pokémon is active during the day and passes the cold desert nights burrowed snugly into the sand;GROUND
though large and languid hippopotas is difficult to detect due to its tendency to burrow into and lurk beneath the soil when agitated or excited it expels sand from its nostrils;GROUND
it shuts its nostrils tight then travels through sand as if walking they form colonies of around 10;GROUND
it blasts internally stored sand from ports on its body to create a towering twister for attack;GROUND
its huge mouth is almost seven feet across it has enough power to completely crush a car;GROUND
it is surprisingly quick to anger it holds its mouth agape as a display of its strength;GROUND
it brandishes its gaping mouth in a display of fearsome strength it raises vast quantities of sand while attacking;GROUND
stones can get stuck in the ports on their bodies dwebble help dislodge such stones so hippowdon look after these pokémon;GROUND
when roused to violence by its rage it spews out the quantities of sand it has swallowed and whips up a sandstorm;GROUND
its huge mouth opens almost seven feet wide it has enough power to completely crush a car;GROUND
short-tempered and easily moved to violence it whips up whirlwinds of sand to crush its foes’ spirits then goes in for the attack;GROUND
it puts rocks in holes in its palms and uses its muscles to shoot them geodude are shot at rare times;GROUND
it can launch a rock held in its hand like a missile by tightening then expanding muscles instantly;GROUND
from holes in its palms it fires out geodude its carapace can withstand volcanic eruptions;GROUND
it can load up to three projectiles per arm into the holes in its hands what launches out of those holes could be either rocks or roggenrola;GROUND
it relies on its carapace to deflect incoming attacks and throw its enemy off balance as soon as that happens it drives its drill into the foe;GROUND
it puts rocks in holes in its palms and uses its muscles to shoot them on rare occasions the pokémon even shoots out geodude;GROUND
this pokémon evolved through use of a curious item its rocklike hide is composed of a mysterious substance and can withstand a blow from a masterwork sword with nary a scratch;GROUND
it can dig through the ground at a speed of 30 mph it could give a car running aboveground a good race;GROUND
it makes its way swiftly through the soil by putting both claws together and rotating at high speed;GROUND
by spinning its body it can dig straight through the ground at a speed of 30 mph;GROUND
it brings its claws together and whirls around at high speed before rushing toward its prey;GROUND
it’s a digger using its claws to burrow through the ground it causes damage to vegetable crops so many farmers have little love for it;GROUND
it can help in tunnel construction its drill has evolved into steel strong enough to bore through iron plates;GROUND
more than 300 feet below the surface they build mazelike nests their activity can be destructive to subway tunnels;GROUND
forming a drill with its steel claws and head it can bore through a steel plate no matter how thick it is;GROUND
it’s not uncommon for tunnels that appear to have formed naturally to actually be a result of excadrill’s rampant digging;GROUND
known as the drill king this pokémon can tunnel through the terrain at speeds of over 90 mph;GROUND
they live in groups of a few individuals protective membranes shield their eyes from sandstorms;GROUND
the special membrane covering its eyes can sense the heat of objects so it can see its surroundings even in darkness;GROUND
protected by thin membranes their eyes can see even in the dead of night they live in groups of a few individuals;GROUND
they move in groups of a few individuals a female is often the leader of the group and the males will gather food;GROUND
thanks to the special membrane covering its eyes it can see its surroundings clearly even in the middle of the night;GROUND
krokorok really hates it when its body gets cold on nights when the temperature drops it digs deep into the desert sands;GROUND
it buries some of its prey in the sand to use as emergency meals when its hunts are unsuccessful;GROUND
krokorok has specialized eyes that enable it to see in the dark this ability lets krokorok hunt in the dead of night without getting lost;GROUND
although this pokémon has specialized eyes that allow it to see in the dark krokorok won’t move much at night—the desert gets cold after sunset;GROUND
the mud stuck to mudbray’s hooves enhances its grip and its powerful running gait;GROUND
it has a stubborn individualistic disposition eating dirt making mud and playing in the mire all form part of its daily routine;GROUND
it loves playing in the mud if it isn’t showered with mud on a daily basis it gets stressed out and stops listening to its trainer;GROUND
possessing mighty power mudbray can be loaded with 50 times its own body weight and will be totally fine;GROUND
loads weighing up to 50 times as much as its own body weight pose no issue for this pokémon it’s skilled at making use of mud;GROUND
it eats dirt to create mud and smears this mud all over its feet giving them the grip needed to walk on rough terrain without slipping;GROUND
this pokémon covers itself in mud that it has regurgitated the mud won’t dry out even if it’s exposed to the sun for a long time;GROUND
though a slow walker mudbray is plenty strong its pace doesn’t change even when it’s loaded with 50 times its own body weight;GROUND
it spits a mud that provides resistance to both wind and rain so the walls of old houses were often coated with it;GROUND
its heavy mud-covered kicks are its best means of attack and it can reduce large trucks to scrap without breaking a sweat;GROUND
